{
  "graph_type": "ProductMarketAnalysisGraph",
  "runs": [
    {
      "run_id": "run-uq-price-ref",
      "route": "product_outbound_market_analysis",
      "created_at": "2026-07-26",
      "updated_at": "2026-07-26",
      "brief_id": "brief-uq-price-ref",
      "brief_version_id": "brief-uq-price-ref-v1",
      "default_export_declaration_country": "China",
      "execution_mode": "sample_static",
      "delivery_status": "ready_with_limitations",
      "not_executed_modules": []
    }
  ],
  "briefs": [
    {
      "brief_id": "brief-uq-price-ref",
      "brief_version_id": "brief-uq-price-ref-v1",
      "product_subject_id": "product-uq-470177",
      "target_country_or_region": "United States",
      "seller_country_or_region": null,
      "export_declaration_country": "China",
      "origin_country_status": {
        "country_or_region": "China",
        "status": "business_confirmation_required",
        "evidence_level": "L1",
        "note": "网页 Production: China 是页面字段，正式原产和起运文件仍待确认。"
      },
      "departure_country_or_region": "China",
      "departure_node": null,
      "destination_node": null,
      "trade_term": null,
      "analysis_modules_requested": [
        "product_profile",
        "destination_compliance",
        "import_tax",
        "logistics"
      ],
      "business_decision_policy": "只给客观参考，不做是否进入市场或客户推荐判断。"
    }
  ],
  "products": [
    {
      "product_subject_id": "product-uq-470177",
      "display_name": "UNIQLO Men's Corduroy Overshirt",
      "version_identifiers": [
        "Product ID 470177"
      ],
      "manufacturer_or_brand": "UNIQLO",
      "product_family": "woven cotton corduroy overshirt",
      "components": [
        {
          "component_id": "component-uq-garment",
          "name": "成衣本体",
          "role": "main_product"
        },
        {
          "component_id": "component-uq-trim",
          "name": "饰边和辅料",
          "role": "trim"
        }
      ],
      "profile_status": "needs_technical_docs",
      "unknown_key_attributes": [
        "实物标签",
        "BOM/辅料",
        "克重/单重",
        "起运港",
        "最终 HTSUS"
      ]
    }
  ],
  "trade_premises": [
    {
      "trade_premise_id": "trade-uq-us",
      "seller_country_or_region": null,
      "export_declaration_country": "China",
      "origin_country_or_region": "China",
      "origin_evidence_level": "L1",
      "departure_country_or_region": "China",
      "departure_node": null,
      "departure_node_status": "business_confirmation_required",
      "departure_node_basis": "Production: China 不能推出具体起运港，需提单、订舱或报关文件确认。",
      "destination_country_or_region": "United States",
      "destination_node": null,
      "status": "business_confirmation_required",
      "separation_check": {
        "roles_separated": true,
        "note": "Production、出口申报国、实际起运地分开记录。"
      },
      "evidence_card_ids": [
        "card-uq-production"
      ],
      "gap_ids": [
        "gap-uq-departure-node"
      ]
    }
  ],
  "attributes": [
    {
      "attribute_id": "attribute-uq-product-id",
      "product_subject_id": "product-uq-470177",
      "component_scope": "成衣本体",
      "attribute_family": "商业与技术",
      "attribute_name": "Product ID",
      "value": "470177",
      "unit": null,
      "status": "verified",
      "trigger_paths": [
        "SKU 版本确认"
      ],
      "evidence_card_ids": [
        "card-uq-product-id"
      ],
      "gap_ids": []
    },
    {
      "attribute_id": "attribute-uq-body-trim",
      "product_subject_id": "product-uq-470177",
      "component_scope": "成衣本体/饰边",
      "attribute_family": "人体消费安全",
      "attribute_name": "网页成分字段",
      "value": "Body 100% Cotton; Trim 100% Cotton",
      "unit": null,
      "status": "verified",
      "trigger_paths": [
        "纺织标签核验"
      ],
      "evidence_card_ids": [
        "card-uq-body-trim"
      ],
      "gap_ids": [
        "gap-uq-bom"
      ]
    }
  ],
  "sources": [
    {
      "source_id": "source-uq-product-page",
      "canonical_url": "https://www.uniqlo.com/us/en/products/E470177-000/00",
      "final_url": "https://www.uniqlo.com/us/en/products/E470177-000/00",
      "publisher_relation": "first_party",
      "provenance": "discovered_public",
      "medium": "website",
      "access_boundary": "public_web"
    },
    {
      "source_id": "source-us-hts-uq",
      "canonical_url": "https://hts.usitc.gov/",
      "final_url": "https://hts.usitc.gov/",
      "publisher_relation": "first_party",
      "provenance": "discovered_public",
      "medium": "website",
      "access_boundary": "public_web"
    }
  ],
  "observations": [
    {
      "observation_id": "observation-uq-product-page",
      "run_id": null,
      "source_id": "source-uq-product-page",
      "capability": "source.open",
      "concrete_tool": "fixture.static_source_open",
      "observed_at": "2026-07-26",
      "access_status": "opened",
      "title": "UNIQLO Product 470177",
      "raw_excerpt": "Product ID: 470177; Body: 100% Cotton; Trim: 100% Cotton; Production: China; RN: 139864; 8-wale corduroy.",
      "page_or_dom_locator": "fixture-visible-excerpt",
      "extraction_method": "fixture_static",
      "language": "en",
      "translation_status": "original"
    },
    {
      "observation_id": "observation-us-hts-620520",
      "run_id": null,
      "source_id": "source-us-hts-uq",
      "capability": "source.open",
      "concrete_tool": "fixture.static_source_open",
      "observed_at": "2026-07-26",
      "access_status": "opened",
      "title": "HTS candidate path",
      "raw_excerpt": "HTS heading 6205.20 covers men's or boys' shirts of cotton, not knitted or crocheted; final classification requires physical garment review.",
      "page_or_dom_locator": "fixture-visible-excerpt",
      "extraction_method": "fixture_static",
      "language": "en",
      "translation_status": "original"
    }
  ],
  "evidence_cards": [
    {
      "evidence_card_id": "card-uq-product-id",
      "run_id": "run-uq-price-ref",
      "brief_version_id": "brief-uq-price-ref-v1",
      "producer_skill": "Skill A - Brief 与属性识别",
      "reviewer_skill": "Skill F - 交付复核",
      "field_domain": "产品属性",
      "field_name": "Product ID",
      "current_value": "470177",
      "status": "verified",
      "source_refs": [
        {
          "source_id": "source-uq-product-page",
          "observation_id": "observation-uq-product-page",
          "relation": "supports"
        }
      ],
      "source_type": "product_page",
      "source_locator": "UNIQLO US product page",
      "source_date": "日期未见",
      "observed_at": "2026-07-26",
      "applicability_scope": "仅限本 fixture 中的产品版本和目标市场",
      "supports": [
        "页面显示 Product ID 470177"
      ],
      "does_not_support": [
        "不能扩展到其它 SKU"
      ],
      "boundary_rule_ids": [
        "EB-TX-04"
      ],
      "review_status": "passed"
    },
    {
      "evidence_card_id": "card-uq-production",
      "run_id": "run-uq-price-ref",
      "brief_version_id": "brief-uq-price-ref-v1",
      "producer_skill": "Skill A - Brief 与属性识别",
      "reviewer_skill": "Skill F - 交付复核",
      "field_domain": "原产地与贸易前提",
      "field_name": "网页 Production 字段",
      "current_value": "China",
      "status": "verified",
      "source_refs": [
        {
          "source_id": "source-uq-product-page",
          "observation_id": "observation-uq-product-page",
          "relation": "supports"
        }
      ],
      "source_type": "product_page",
      "source_locator": "UNIQLO US product page",
      "source_date": "日期未见",
      "observed_at": "2026-07-26",
      "applicability_scope": "仅限本 fixture 中的产品版本和目标市场",
      "supports": [
        "页面显示 Production: China"
      ],
      "does_not_support": [
        "不能替代海关最终原产地裁定",
        "不能推出出口申报国或起运港"
      ],
      "boundary_rule_ids": [
        "EB-ORI-03",
        "EB-TX-02"
      ],
      "review_status": "passed"
    },
    {
      "evidence_card_id": "card-uq-body-trim",
      "run_id": "run-uq-price-ref",
      "brief_version_id": "brief-uq-price-ref-v1",
      "producer_skill": "Skill A - Brief 与属性识别",
      "reviewer_skill": "Skill F - 交付复核",
      "field_domain": "产品属性",
      "field_name": "Body / Trim 成分",
      "current_value": "Body 100% Cotton; Trim 100% Cotton",
      "status": "verified",
      "source_refs": [
        {
          "source_id": "source-uq-product-page",
          "observation_id": "observation-uq-product-page",
          "relation": "supports"
        }
      ],
      "source_type": "product_page",
      "source_locator": "UNIQLO US product page",
      "source_date": "日期未见",
      "observed_at": "2026-07-26",
      "applicability_scope": "仅限本 fixture 中的产品版本和目标市场",
      "supports": [
        "页面显示 Body/Trim 均为 100% Cotton"
      ],
      "does_not_support": [
        "不能推导辅料/BOM 或全成分无动物材料"
      ],
      "boundary_rule_ids": [
        "EB-TX-01"
      ],
      "review_status": "passed"
    },
    {
      "evidence_card_id": "card-uq-rn-care",
      "run_id": "run-uq-price-ref",
      "brief_version_id": "brief-uq-price-ref-v1",
      "producer_skill": "Skill A - Brief 与属性识别",
      "reviewer_skill": "Skill F - 交付复核",
      "field_domain": "产品属性",
      "field_name": "RN 与洗护网页字段",
      "current_value": "RN 139864; cold gentle machine wash or dry clean",
      "status": "verified",
      "source_refs": [
        {
          "source_id": "source-uq-product-page",
          "observation_id": "observation-uq-product-page",
          "relation": "supports"
        }
      ],
      "source_type": "product_page",
      "source_locator": "UNIQLO US product page",
      "source_date": "日期未见",
      "observed_at": "2026-07-26",
      "applicability_scope": "仅限本 fixture 中的产品版本和目标市场",
      "supports": [
        "页面显示 RN 和洗护说明"
      ],
      "does_not_support": [
        "不能替代实物标签合规核验"
      ],
      "boundary_rule_ids": [
        "EB-TX-03"
      ],
      "review_status": "passed"
    },
    {
      "evidence_card_id": "card-uq-htsus-candidate",